date,team,only,perso,texten,textfr
06/11/2023,STRUDEL,,,"The closing SODUCO-BNF seminar will be held on 6 and 7 November (more information <a href=""https://soduco.github.io/"" target=""_blank"">here</a>)","Le séminaire de clôture du programme ANR SoDUCo se tiendra les lundi 6 & Mardi 7 Novembre (plus d'informations <a href=""https://soduco.github.io/"" target=""_blank"">ici</a>)"
07/09/2023,ACTE,,,"Lulin Zhang received the ""Best Paper Award"" for her work entitled ""SPARSESAT-NERF: Dense Depth Supervised Neural Radiance Fields for Sparse Satellite Images, Lulin Zhang, Ewelina Rupnik"" in ""PhotoGA 2023"" Workshop at ISPRS Geospatial Week 2023","Lulin Zhang a reçu le prix du meilleur article pour son travail intitulé ""SPARSESAT-NERF: Dense Depth Supervised Neural Radiance Fields for Sparse Satellite Images, Lulin Zhang, Ewelina Rupnik"" lors de l'atelier ""PhotoGA 2023"" à l'ISPRS Geospatial Week 2023"
07/09/2023,MEIG,,,"Ibrahim Maidaneh Abdi received the ""Best Paper Award"" for his work entitled ""A Classification Model for The Inference of Spatial Precision of OpenStreetMap Buildings with Intrinsic Indicators, Ibrahim Maidaneh Abdi, Arnaud Le Guilcher, Ana-Maria Olteanu-Raimond"" in ""Crowdsourcing"" Workshop at ISPRS Geospatial Week 2023","Ibrahim Maidaneh Abdi a reçu le prix du meilleur article pour son travail intitulé ""A Classification Model for The Inference of Spatial Precision of OpenStreetMap Buildings with Intrinsic Indicators, Ibrahim Maidaneh Abdi, Arnaud Le Guilcher, Ana-Maria Olteanu-Raimond"" lors de l'atelier ""Crowdsourcing"" à l'ISPRS Geospatial Week 2023"
07/09/2023,STRUDEL,,,"Martin Cubaud received the ""Best Presentation Award"" for his work entitled ""Comparison of two data fusion approaches for land use classification », Martin Cubaud, Arnaud Le Bris, Laurence Jolivet, Ana-Maria Olteanu-Raimond"" in ""ISSDQ"" Workshop at ISPRS Geospatial Week 2023","Martin Cubaud a reçu le prix de la meilleure présentation pour son travail intitulé ""Comparison of two data fusion approaches for land use classification,  Martin Cubaud, Arnaud Le Bris, Laurence Jolivet, Ana-Maria Olteanu-Raimond"" lors de l'atelier ""ISSDQ"" à l'ISPRS Geospatial Week 2023"
30/08/2023,STRUDEL,,,"AMI SOTIQUE project has been accepted. The project focuses on the risk of tick bites in urban nature areas based on participatory and multi-stakeholder research. The consortium is made up of three laboratories LISIS (UMR 1326), LAMA (UMR 8050) and LASTIG; Laurence Jolivet is the LASTIG scientific manager","Le projet AMI SOTIQUE a été accepté. Le projet porte sur le risque de piqûres de tiques dans des espaces de nature en ville à partir d’une recherche participative et multi-acteurs. Le consortium est composé de trois laboratoires  LISIS (UMR 1326), LAMA (UMR 8050) et le LASTIG ; Laurence Jolivet est la responsable scientifique LASTIG"
19/07/2023,STRUDEL,,,"Paper accepted at ICCV23! Efficient 3D segmentation with Superpoint Transformer : Damien Robert and Loïc Landrieu",Papier accepté à ICCV23! Efficient 3D segmentation with Superpoint Transformer : Damien Robert et Loïc Landrieu
07/07/2023,MEIG,,,ANR IntForOut project has been accepted (july 2023)! Multisource spatial data INTegration semantic enhancement and qualification for the Monitoring of Ecosystems under the pressure of OUTdoor recreation; with LASTIG (leader)-LIFAT (Univ. Tours)-LECA (Univ. Chambéry) et le CREA Mont-Blanc," Le projet ANR IntForOut a été accepté (juillet 2023)! Intégration de données spatiales multisources amélioration sémantique et qualification pour le suivi des écosystèmes sous la pression des loisirs de plein air; avec LASTIG (leader)--LIFAT (Univ. Tours)-LECA (Univ. Chambéry) et le CREA Mont-Blanc"
05/07/2023,STRUDEL,,,"Solenn Tual obtained a special award at Ingénierie des Connaissances (IC'2023) for the paper ""Création d'un graphe de connaissances géohistorique à partir d'annuaires du commerce parisien du 19ème siècle: application aux métiers de la photographie""","Solenn Tual a eu le Prix spécial de la Conférence Ingénierie des Connaissances (IC 2023) pour le papier ""Création d'un graphe de connaissances géohistorique à partir d'annuaires du commerce parisien du 19ème siècle: application aux métiers de la photographie"""
06/06/2023,MEIG,,,"Mattia Bunel receives the 2023 GDR CNRS MAGIS award for his thesis entitled ""Modélisation et raisonnement spatial fuou pour l'aide à la localisation des victimes en montagne""","Mattia Bunel-a reçu le prix de thèse 2023 du GDR CNRS MAGIS pour sa thèse ""Modélisation et raisonnement spatial flou pour l’aide à la localisation des victimes en montagne"""
16/05/2023,STRUDEL,,,"Solenn Tual obtained the best poster award of the Doctoral PhD day'2023 organised by MSTIC for her poster ""Reconstitution automatique de la généalogie des parcelles et des bâtiments à partir de sources historiques""","Solenn Tual a obtenu le prix du meilleur poster de la Journée des doctorants de l'école Doctorale MSTIC'2023 pour le poster ""Reconstitution automatique de la généalogie des parcelles et des bâtiments à partir de sources historiques"""
23/09/2022,ACTE,,,Lulin Zhang receives the 2022 EuroSDR PhD Award for her work on Feature matching for multi-epoch historical aerial images,Lulin Zhang reçoit le prix de la thèse 2022 de l’EuroSDR pour son travail sur l’appariement des caractéristiques pour les images aériennes historiques multi-époques
20/06/2022,ACTE,,,"Dimitri Gominski obtains the Best Paper Award At EarthVision @CVPR'22 for his work ""Cross-dataset Learning for Generalizable Land Use Scene Classification""","Dimitri Gominski obtient le prix du meilleur article à EarthVision @CVPR'22 pour son travail intitulé ""Cross-dataset Learning for Generalizable Land Use Scene Classification"""
09/06/2022,ACTE,,vallet,Rahima Djahel obtains a Best Poster Award at ISPRS2022 congress in Nice for her work on A 3D SEGMENTS BASED ALGORITHM FOR HETEROGENEOUS DATA REGISTRATION,Rahima Djahel obtiens le prix du meilleur poster au congrès de l'ISPRS2022 à Nice pour son travail intitulé A 3D SEGMENTS BASED ALGORITHM FOR HETEROGENEOUS DATA REGISTRATION
25/03/2022,MEIG,,,"Seminar <a href=""https://parvis.hypotheses.org/2791""> Balade sensible (dans la ville trop chaude) </a>, organized with the PARVIS project (I-SITE FUTURE), in conjunction with the EHESS <a href=""https://enseignements.ehess.fr/2021-2022/ue/977""> seminar of perceptive cartography </a>","Organisation du séminaire <a href=""https://parvis.hypotheses.org/2791""> Balade sensible (dans la ville trop chaude) </a> dans le cadre du projet PARVIS (I-SITE FUTURE), en collaboration avec le <a href=""https://enseignements.ehess.fr/2021-2022/ue/977""> séminaire de cartographie sensible </a> de l'EHESS."
01/01/2021,LASTIG,,,"Clément Mallet is now Editor-in-Chief of the <a href=""https://www.journals.elsevier.com/isprs-journal-of-photogrammetry-and-remote-sensing"" target=""_blank"">ISPRS Journal of Photogrammetry and Remote Sensing</a>","Clément Mallet est désormais éditeur-en-chef de l'<a href=""https://www.journals.elsevier.com/isprs-journal-of-photogrammetry-and-remote-sensing"" target=""_blank"">ISPRS Journal of Photogrammetry and Remote Sensing</a>"
09/12/2020,LASTIG,,,Guillaume Touya received an ERC Consolidator Grant 2020 for the LostInZoom project #ERCCoG,Guillaume Touya a obtenu une bourse ERC Consolidator 2020 pour le projet LostInZoom #ERCCoG
01/10/2020,LASTIG,,,"Ewelina Rupnik is now Editor-in-Chief of the <a href=""https://rfpt.sfpt.fr/index.php/RFPT"" target=""_blank"">French Journal of Photogrammetry and Remote Sensing</a>","Ewelina Rupnik est désormais éditrice-en-chef de la <a href=""https://rfpt.sfpt.fr/index.php/RFPT"" target=""_blank"">Revue Française de Photogrammétrie et de Télédétection</a>"
03/06/2020,LASTIG,,,"Election to the unit concil of LASTIG of the list: Paul Chapron, Julien Perret, Bénédicte Fruneau, Ewelina Rupnik, Jacques Gautier, Mehdi Zrhal, Christophe Meynard","Election au conseil d'unité du LASTIG de la liste : Paul Chapron, Julien Perret, Bénédicte Fruneau, Ewelina Rupnik, Jacques Gautier, Mehdi Zrhal, Christophe Meynard"
05/05/2020,ACTE,,,"Marc Pierrot Deseilligny received the 2020 <a href=""https://www.isprs.org/society/awards/inghilleri.aspx"">Giuseppe Inghilleri Award</a> of the ISPRS. Congratulations!","Marc Pierrot Deseilligny recoit le <a href=""https://www.isprs.org/society/awards/inghilleri.aspx""> prix Giuseppe Inghilleri</a>  2020 de l'ISPRS"
01/01/2019,LASTIG,,,Official creation of the LASTIG lab,Création officielle du LASTIG
