type,titre,title,pdf_fr,pdf_en,team,filled
Internship,Exploration visuelle et interactive des variables de scénarios de submersion simulés (ANR ORACLES),Interactive visual exploration of simulated marine submersion scenarios (ANR ORACLES),/lastig_data/pdf/2021_Stage_LASTIG_BRGM_URL.pdf,/lastig_data/pdf/2021_Stage_LASTIG_BRGM_URL.pdf,GEOVIS,false
EC,Maître de Conférences en Apprentissage et vision par ordinateur pour la télédétection,Lecturer in machine learning and computer vision for remote sensing,https://www.galaxie.enseignementsup-recherche.gouv.fr/ensup/ListesPostesPublies/ANTEE/2022_1/0772894C/FOPC_0772894C_58.pdf,STRUDEL,false
Internship,Import des données massives. Quel impact sur les données et la communauté d’OpenStreetMap ?, Impact of massive data dumps on the OpenStreetMap community, /lastig_data/pdf/StageLASTIG_importMassiveOSM.pdf,/lastig_data/pdf/StageLASTIG_importMassiveOSM.pdf,MEIG,false
ingenieur,DÉVELOPPEUR/EUSE WEB FULLSTACK PYTHON FLASK,FULLSTACK WEB PYTHON FLASK DEVELOPER,https://soduco.github.io/static/documents/SoDUCo2021DevelopFlask.pdf,https://soduco.github.io/static/documents/SoDUCo2021DevelopFlask.pdf,STRUDEL,false
PhD,Adaptation de domaine spatio-temporelle en Observation de la Terre, Spatio-Temporal Domain Adaptation for Earth Observation,"/lastig_data/pdf/PHD_TERRIA_web.pdf","/lastig_data/pdf/PHD_TERRIA_web.pdf",STRUDEL, false
